Produktname,Kategorie,Unterkategorie,Preis_EUR,Startdatum,Enddatum,Supermarkt
IronMaxx 100% Whey Proteinpulver (versch. Sorten Je 500g),Sportnahrung,Proteine,12.99,2025-05-19,2025-05-24,Lidl
Rauch Happy Day Saft (versch. Sorten Je 1l),Getränke,Säfte,1.99,2025-05-19,2025-05-24,Lidl
Haribo (versch. Sorten Je 175g/160g),Lebensmittel,Süßwaren,0.89,2025-05-19,2025-05-24,Lidl
Dilek TwistnTaste Waffelröllchen (versch. Sorten Je 150g),Lebensmittel,Süßwaren/Gebäck,1.39,2025-05-19,2025-05-24,Lidl
IronMaxx Cup mit Griff (versch. Farben 1.2 Liter),Haushalt/Sport,Trinkflaschen/Zubehör,14.99,2025-05-19,2025-05-24,Lidl
Coca-Cola/Fanta/Sprite/Mezzo Mix (versch. Sorten Je 1.25 Liter zzgl. Pfand),Getränke,Softdrinks,1.11,2025-05-19,2025-05-24,Lidl
Ehrmann Foodie (versch. Sorten Je 400ml zzgl. Pfand),Lebensmittel,Getränke/Fertigdrinks,2.79,2025-05-19,2025-05-24,Lidl
Persil Waschmittel (Discs Gel oder Pulver Je 60/80/75 WL),Drogerie,Waschmittel,16.99,2025-05-19,2025-05-24,Lidl
Monster Energy (10er-Pack Je Gebinde 10x0.5l zzgl. Pfand),Getränke,Energy Drinks,8.88,2025-05-19,2025-05-24,Lidl
Gösser Natur Radler (versch. Sorten Je 0.5l zzgl. Pfand),Getränke,Alkoholische Getränke/Bier,0.89,2025-05-19,2025-05-24,Lidl
Domestos WC Stein Power 5 (5er-Pack versch. Sorten Je 5x50g),Drogerie,Reinigungsmittel,4.99,2025-05-19,2025-05-24,Lidl
Asbach Uralt (36% vol Je 0.7l auch online),Getränke,Alkoholische Getränke/Spirituosen,9.99,2025-05-19,2025-05-24,Lidl
Tullamore D.E.W. Irish Whiskey (40% vol Je 0.7l auch online),Getränke,Alkoholische Getränke/Spirituosen,13.99,2025-05-19,2025-05-24,Lidl
S-O-S Pflaster Mix Pack (versch. Sorten Je 14/15/20 Stück),Drogerie,Erste Hilfe,1.99,2025-05-19,2025-05-24,Lidl
Captain Morgan Original Spiced Gold (35% vol Je 0.7l auch online),Getränke,Alkoholische Getränke/Spirituosen,9.99,2025-05-19,2025-05-24,Lidl
Korol Vodka (5-fach destilliert 40% vol Je 0.5l auch online),Getränke,Alkoholische Getränke/Spirituosen,5.49,2025-05-19,2025-05-24,Lidl
Zewa Toilettenpapier Ultra Soft (4-lagig Je 20x150 Blatt),Drogerie,Hygienepapier,8.49,2025-05-19,2025-05-24,Lidl
Milram Knobi & Chili Quark (Je 379g),Lebensmittel,Milchprodukte/Quark,1.99,2025-05-19,2025-05-24,Lidl
Nothwang Aufschnitt XXL (versch. Sorten Je 150g),Lebensmittel,Wurst/Aufschnitt,1.99,2025-05-19,2025-05-24,Lidl
Geflügel-Bratwurst XXL (Je 720g),Lebensmittel,Wurst,5.99,2025-05-19,2025-05-24,Lidl
Ferdi Fuchs Mini Cabanossi (Doppelpack Je Gebinde 2x75g),Lebensmittel,Wurst/Snacks,2.22,2025-05-19,2025-05-24,Lidl
Pringles (+35g gratis versch. Sorten Je 200g),Lebensmittel,Snacks/Chips,1.89,2025-05-19,2025-05-24,Lidl
Snickers/Twix/Mars (10er-Pack Je 500g/450g),Lebensmittel,Süßwaren,3.99,2025-05-19,2025-05-24,Lidl
Surig Essig-Essenz (+50g gratis Je 450g),Lebensmittel,Essig/Öl,1.11,2025-05-19,2025-05-24,Lidl
Axe For Men Bodywash/Gel douche (Trio Pack versch. Sorten Je 3x250ml),Drogerie,Körperpflege,4.99,2025-05-19,2025-05-24,Lidl
Listerine Mundspülung (2er-Pack versch. Sorten Je 2x600ml),Drogerie,Mundpflege,6.79,2025-05-19,2025-05-24,Lidl
Purina Gourmet Perle Erlesene Streifen in Sauce (24er-Pack Je 24x85g),Tiernahrung,Katzenfutter,9.99,2025-05-19,2025-05-24,Lidl
Nadler Sahne Heringsfilets (+10% GRATIS versch. Sorten Je 440g),Lebensmittel,Fisch,1.99,2025-05-19,2025-05-24,Lidl
Femeg Schollenfilet aus der Nordsee (Je 250g),Lebensmittel,Tiefkühlkost/Fisch,4.49,2025-05-19,2025-05-24,Lidl
Dulano Jagdwurst (versch. Sorten nach norddeutscher Art Je 1kg),Lebensmittel,Wurst,4.29,2025-05-19,2025-05-24,Lidl
Nordsee Knuspergarnelen (Je 200g),Lebensmittel,Tiefkühlkost/Fisch,3.59,2025-05-19,2025-05-24,Lidl
Rügen Fisch Heringsfilets (versch. Sorten Je 200g),Lebensmittel,Fischkonserven,0.99,2025-05-19,2025-05-24,Lidl
Lübzer Pils (Je 0.5l zzgl. Pfand),Getränke,Alkoholische Getränke/Bier,0.69,2025-05-19,2025-05-24,Lidl
Steam Brew Hopfen Gin (42% vol Je 0.7l nur online),Getränke,Alkoholische Getränke/Spirituosen,10.99,2025-05-11,2025-05-24,Lidl
Evermann Wilhelm Black Forest Double Distilled Single Malt Whisky (42% vol Je 0.7l nur online),Getränke,Alkoholische Getränke/Spirituosen,26.99,2025-05-11,2025-05-24,Lidl
BIO Weingut Balthasar Ress Rheinkind Riesling VDP.Gutswein Weißwein feinherb vegan (Je 0.75l nur online),Getränke,Alkoholische Getränke/Wein,8.99,2025-05-11,2025-05-24,Lidl
Markus Molitor M Sauvignon Blanc QbA Weißwein trocken (Je 0.75l nur online),Getränke,Alkoholische Getränke/Wein,8.99,2025-05-11,2025-05-24,Lidl
Riesling Scheurebe QbA Weißwein halbtrocken (Je 0.75l nur online),Getränke,Alkoholische Getränke/Wein,3.99,2025-05-11,2025-05-24,Lidl
Früh Kölsch Bierfass (5 Liter nur online),Getränke,Alkoholische Getränke/Bier,12.99,2025-05-11,2025-05-24,Lidl
1272 Schaubeck Spätburgunder Rotwein trocken (Je 0.75l nur online),Getränke,Alkoholische Getränke/Wein,4.99,2025-05-11,2025-05-24,Lidl
Staatsweingut Weinsberg Rosé VDP.Gutswein Roséwein trocken (Je 0.75l nur online),Getränke,Alkoholische Getränke/Wein,5.9,2025-05-11,2025-05-24,Lidl
Milbona Cheddar (Original irischer aus nordirischer Weidemilch gerieben/in Scheiben versch. Sorten Je 200g/175g),Lebensmittel,Milchprodukte/Käse,1.99,2025-05-19,2025-05-24,Lidl
Milbona Gouda/Kräutern/Sahnig Schmelzkäseschale (versch. Sorten Je 200g),Lebensmittel,Milchprodukte/Käse,1.35,2025-05-19,2025-05-24,Lidl
Milbona Halloumi g.U. (Je 225g Lidl Plus),Lebensmittel,Milchprodukte/Käse,2.15,2025-05-19,2025-05-24,Lidl
Milbona Crefée Frischkäse (versch. Sorten Je 150g Lidl Plus),Lebensmittel,Milchprodukte/Käse,1.05,2025-05-19,2025-05-24,Lidl
Milbona Weißkäse in Salzlake (Je 1.5kg Abtropfgewicht 1kg Lidl Plus),Lebensmittel,Milchprodukte/Käse,6.49,2025-05-19,2025-05-24,Lidl
Milbona Emmentaler am Stück (Je 400 g),Lebensmittel,Milchprodukte/Käse,3.05,2025-05-19,2025-05-24,Lidl
Milbona Kashkaval Käse (Je 750 g),Lebensmittel,Milchprodukte/Käse,3.99,2025-05-19,2025-05-24,Lidl
Milbona Mascarpone (Je 250 g),Lebensmittel,Milchprodukte/Käse,1.75,2025-05-19,2025-05-24,Lidl
Milbona Edamer in Scheiben (Je 400 g),Lebensmittel,Milchprodukte/Käse,2.39,2025-05-19,2025-05-24,Lidl
Milbona Tilsiter (Je 400 g),Lebensmittel,Milchprodukte/Käse,2.39,2025-05-19,2025-05-24,Lidl
Milbona Le Gruyère/Appenzeller (Je 200/170 g),Lebensmittel,Milchprodukte/Käse,3.19,2025-05-19,2025-05-24,Lidl
Dulano Gebackene Hähnchenbrust (versch. Sorten  Je 80 g),Lebensmittel,Wurstwaren/Geflügelaufschnitt,1.05,2025-05-19,2025-05-24,Lidl
Dulano Delikatess Bierschinken Stapelpack (versch. Sorten  Je 150 g),Lebensmittel,Wurstwaren,0.95,2025-05-19,2025-05-24,Lidl
Dulano Delikatess Leichte Schinkenwürfel (Je 2x 75 g  Lidl Plus),Lebensmittel,Wurstwaren,1.49,2025-05-19,2025-05-24,Lidl
Dulano Delikatess Lachsschinken (geschnitten  Je 150 g),Lebensmittel,Wurstwaren,1.99,2025-05-19,2025-05-24,Lidl
Dulano Kochschinken/Hähnchenbrust/Putenbrust (hauchdünn geschnitten  Je 200 g),Lebensmittel,Wurstwaren/Aufschnitt,1.99,2025-05-19,2025-05-24,Lidl
Dulano Selection Italienische Wurstspezialitäten (versch. Sorten  Je 150/100 g),Lebensmittel,Wurstwaren,1.59,2025-05-19,2025-05-24,Lidl
Dulano Rindersaftschinken (versch. Sorten  Je 100 g),Lebensmittel,Wurstwaren,1.69,2025-05-19,2025-05-24,Lidl
Dulano Bayerischer Mini-Leberkäse (versch. Sorten  Je 400/350 g),Lebensmittel,Wurstwaren/Fleischkäse,2.79,2025-05-19,2025-05-24,Lidl
Milbona Sandwich Scheiben (versch. Sorten  Je 200 g  Lidl Plus),Lebensmittel,Milchprodukte/Käse,2.09,2025-05-19,2025-05-24,Lidl
Milbona Körniger Frischkäse XXL (versch. Sorten  Je 400 g),Lebensmittel,Milchprodukte/Frischkäse,1.69,2025-05-19,2025-05-24,Lidl
Dulano Streichzwerge (versch. Sorten  Je 130 g  Lidl Plus),Lebensmittel,Wurstwaren/Streichwurst,1.19,2025-05-19,2025-05-24,Lidl
Dulano Aspik Wurstsortiment (versch. Sorten  Je 200 g),Lebensmittel,Wurstwaren/Aspik,1.59,2025-05-19,2025-05-24,Lidl
Milbona Gorgonzola DOP (versch. Sorten  Je 200 g  Lidl Plus),Lebensmittel,Milchprodukte/Käse,2.09,2025-05-19,2025-05-24,Lidl
Dulano Delikatess Snackis XXL (geräuchert  Je 265 g 8er-Pack),Lebensmittel,Wurstwaren/Snacks,1.69,2025-05-19,2025-05-24,Lidl
Dulano Delikatess Lyoner (Je 200 g  Lidl Plus),Lebensmittel,Wurstwaren,0.79,2025-05-19,2025-05-24,Lidl
Dulano Delikatess Schinkenbraten (versch. Sorten  Je 100 g),Lebensmittel,Wurstwaren/Aufschnitt,1.19,2025-05-19,2025-05-24,Lidl
Dulano Delikatess Frikadellen (versch. Sorten  Je 500/450 g  Lidl Plus),Lebensmittel,Fleischwaren/Fertiggerichte,2.39,2025-05-19,2025-05-24,Lidl
Dulano Salami (versch. Sorten  Je 200 g  Lidl Plus),Lebensmittel,Wurstwaren/Salami,2.39,2025-05-19,2025-05-24,Lidl
Duc de Coeur Premium Eis (versch. Sorten  Je 850 ml  Tiefkühlung),Lebensmittel,Tiefkühlkost/Eis,1.99,2025-05-22,2025-05-24,Lidl
Duc de Coeur Französische Dessert Spezialitäten (versch. Sorten  enthält Alkohol  Je 450 g  Kühlung),Lebensmittel,Desserts/Kühlregal,2.99,2025-05-22,2025-05-24,Lidl
Duc de Coeur Macarons (Je 12x 12 g  Kühlung),Lebensmittel,Gebäck/Kühlregal,3.49,2025-05-22,2025-05-24,Lidl
Les Surgelés Eclair (versch. Sorten  Je 4x 60 g  Tiefkühlung),Lebensmittel,Tiefkühlkost/Gebäck,2.99,2025-05-22,2025-05-24,Lidl
Duc de Coeur Crème Caramel (Je 4x 100 g  Kühlung),Lebensmittel,Desserts/Kühlregal,1.79,2025-05-22,2025-05-24,Lidl
Duc de Coeur Mousse (versch. Sorten  Je 4x 60 g  Kühlung),Lebensmittel,Desserts/Kühlregal,1.29,2025-05-22,2025-05-24,Lidl
Duc de Coeur Mini-Eclairs (Je 200 g  Tiefkühlung),Lebensmittel,Tiefkühlkost/Gebäck,1.99,2025-05-22,2025-05-24,Lidl
Duc de Coeur Schneckenkuchen (versch. Sorten  Je 400 g),Lebensmittel,Backwaren,2.49,2025-05-22,2025-05-24,Lidl
Duc de Coeur Mini-Chinois (versch. Sorten  Je 300 g),Lebensmittel,Backwaren,2.49,2025-05-22,2025-05-24,Lidl
Duc de Coeur Briochezopf mit Schokostückchen (Je 600 g  Lidl Plus 2.29),Lebensmittel,Backwaren,2.99,2025-05-22,2025-05-24,Lidl
Bonne Maman Tartelettes Citron (Je 125 g),Lebensmittel,Gebäck/Süßwaren,2.79,2025-05-22,2025-05-24,Lidl
Bonne Maman Konfitüre/Gelee (versch. Sorten  Je 370 g),Lebensmittel,Brotaufstrich/Konfitüre,2.49,2025-05-22,2025-05-24,Lidl
Duc de Coeur Madeleines mit Schokofüllung (Je 240 g),Lebensmittel,Gebäck,1.99,2025-05-22,2025-05-24,Lidl
Duc de Coeur Crêpes mit Schokoladencremefüllung (Je 8x 32 g),Lebensmittel,Gebäck/Süßwaren,1.99,2025-05-22,2025-05-24,Lidl
Lillet Blanc/Rosé (17% vol  Je 0.75 l),Getränke,Alkoholische Getränke/Aperitif,11.99,2025-05-22,2025-05-24,Lidl
Duc de Coeur 4 Käserollen (mit Emmentaler garniert  Je 4x 130 g  Kühlung),Lebensmittel,Backwaren/Snacks,2.99,2025-05-22,2025-05-24,Lidl
Duc de Coeur Quiche Lorraine/Lauch-Tarte (Je 400 g  Kühlung),Lebensmittel,Fertiggerichte/Kühlregal,2.49,2025-05-22,2025-05-24,Lidl
Duc de Coeur Coulommiers de Caractère (Original französischer Weichkäse  Je 350 g  Kühlung),Lebensmittel,Milchprodukte/Käse,3.79,2025-05-22,2025-05-24,Lidl
Spécialités françaises/French Style Französische Spezialitäten (versch. Sorten  Je 80 g  Kühlung),Lebensmittel,Wurstwaren/Spezialitäten,1.99,2025-05-22,2025-05-24,Lidl
Bresso Frischkäse (versch. Sorten  Je 150 g  Kühlung),Lebensmittel,Milchprodukte/Frischkäse,1.29,2025-05-22,2025-05-24,Lidl
Soignon Ziegenkäse (versch. Sorten  Je 100/150 g  Kühlung),Lebensmittel,Milchprodukte/Käse,2.29,2025-05-22,2025-05-24,Lidl
Claudel/Istara Käsespezialitäten (versch. Sorten  Je 220/200/150 g  Kühlung),Lebensmittel,Milchprodukte/Käse,2.99,2025-05-22,2025-05-24,Lidl
Jean Cornelius Pinot Blanc Collection Prestige AOP (Weißwein trocken  Je 0.75 l),Getränke,Alkoholische Getränke/Wein,3.99,2025-05-22,2025-05-24,Lidl
Duc de Coeur Fisch Teigtaschen (versch. Sorten  Je 2x 170 g  Kühlung),Lebensmittel,Fertiggerichte/Kühlregal,2.99,2025-05-22,2025-05-24,Lidl
Duc de Coeur Weinberg-Schnecken (gefüllt mit Petersilie und Knoblauch  Je 67 g  Tiefkühlung  Lidl Plus 2.99),Lebensmittel,Tiefkühlkost/Spezialitäten,3.79,2025-05-22,2025-05-24,Lidl
Aoste Salami (versch. Sorten  Je 250/225 g),Lebensmittel,Wurstwaren/Salami,3.99,2025-05-22,2025-05-24,Lidl
Duc de Coeur Flammkuchen (versch. Sorten  Je 260 g  Tiefkühlung),Lebensmittel,Tiefkühlkost/Pizza-ähnlich,2.39,2025-05-22,2025-05-24,Lidl
French Style Ringsalami (Je 300 g  Kühlung),Lebensmittel,Wurstwaren/Salami,3.49,2025-05-22,2025-05-24,Lidl
French Style Walnuss-Salami (luftgetrocknet  Je 250 g  Kühlung),Lebensmittel,Wurstwaren/Salami,2.99,2025-05-22,2025-05-24,Lidl
Monalie Côtes de Provence AOP (Roséwein trocken  Je 0.75 l),Getränke,Alkoholische Getränke/Wein,5.99,2025-05-22,2025-05-24,Lidl
Côtes du Rhône Villages AOP (Rotwein 2023 trocken  Je 0.75 l  Lidl Plus 2.49),Getränke,Alkoholische Getränke/Wein,2.99,2025-05-22,2025-05-24,Lidl
Heidsieck & Co Monopole Blue Top (Champagner brut  Je 0.75 l),Getränke,Alkoholische Getränke/Champagner,24.99,2025-05-22,2025-05-24,Lidl
Duc de Coeur Käse-Aperitifbox (Je 425 g  Tiefkühlung),Lebensmittel,Tiefkühlkost/Snacks,3.99,2025-05-22,2025-05-24,Lidl
Duc de Coeur Blätterteigtasche mit Lachs und Spinat (Je 500 g  Kühlung),Lebensmittel,Fertiggerichte/Kühlregal,4.99,2025-05-22,2025-05-24,Lidl
Duc de Coeur Brie Torte (Herkunft Normandie  Je 500 g  Kühlung),Lebensmittel,Milchprodukte/Käse,4.99,2025-05-22,2025-05-24,Lidl
Duc de Coeur Ziegenrolle (versch. Sorten  Je 100 g  Kühlung),Lebensmittel,Milchprodukte/Käse,1.99,2025-05-22,2025-05-24,Lidl
Duc de Coeur Snacking Weichkäse (versch. Sorten  Je 180 g  Kühlung),Lebensmittel,Milchprodukte/Käse,1.99,2025-05-22,2025-05-24,Lidl
French Style Fleischbällchen (versch. Sorten  Je 280 g  Kühlung),Lebensmittel,Fleischwaren/Fertiggerichte,2.79,2025-05-22,2025-05-24,Lidl
French Style Französische Salami (versch. Sorten  Je 120 g  Kühlung),Lebensmittel,Wurstwaren/Salami,1.99,2025-05-22,2025-05-24,Lidl
French Style Gourmet-Salami (versch. Sorten  Je 250 g  Kühlung),Lebensmittel,Wurstwaren/Salami,2.99,2025-05-22,2025-05-24,Lidl
Duc de Coeur Lachs-Tarte (mit Lauch  Je 400 g  Kühlung),Lebensmittel,Fertiggerichte/Kühlregal,2.79,2025-05-22,2025-05-24,Lidl
French Style Flammkuchenschnecken (versch. Sorten  Je 270 g  Kühlung),Lebensmittel,Backwaren/Snacks,1.99,2025-05-22,2025-05-24,Lidl
Duc de Coeur Pizzatasche (versch. Sorten  Je 3x 120 g  Tiefkühlung),Lebensmittel,Tiefkühlkost/Snacks,2.99,2025-05-22,2025-05-24,Lidl
Duc de Coeur Crêpes (gefüllt in versch. Sorten  Je 192 g),Lebensmittel,Gebäck/Süßwaren,1.99,2025-05-22,2025-05-24,Lidl
Duc de Coeur Brioche Chinois (versch. Sorten  Je 350 g),Lebensmittel,Backwaren,2.49,2025-05-22,2025-05-24,Lidl
Duc de Coeur Gebäckstangen (versch. Sorten  Je 125 g),Lebensmittel,Gebäck/Snacks,1.29,2025-05-22,2025-05-24,Lidl
Costières de Nîmes AOP Roséwein (trocken  Je 0.75 l),Getränke,Alkoholische Getränke/Wein,2.99,2025-05-22,2025-05-24,Lidl
Lidanis Pastis (40% vol  Je 1 l),Getränke,Alkoholische Getränke/Spirituosen,10.99,2025-05-22,2025-05-24,Lidl
Milbona Bio Hirtenkäse (Bioland  Je 200 g  Kühlung),Lebensmittel,Milchprodukte/Käse,1.99,2025-05-19,2025-05-24,Lidl
Milbona Bio Crème Fraîche (Bioland  Je 150 g  Kühlung),Lebensmittel,Milchprodukte,0.89,2025-05-19,2025-05-24,Lidl
Milbona Bio Fruchtjoghurt mild (Bioland  versch. Sorten  Je 400 g  Kühlung),Lebensmittel,Milchprodukte/Joghurt,1.19,2025-05-19,2025-05-24,Lidl
Grafschafter Bio 4 Körner Krusti / Bio 4 Steinofen Brötchen (Bioland  Je 4x 90/4x 95 g),Lebensmittel,Backwaren/Brötchen,1.99,2025-05-19,2025-05-24,Lidl
Milbona Bio Frische fettarme Milch 1.5% (Bioland  Je 1 l  Kühlung),Lebensmittel,Milchprodukte/Milch,1.15,2025-05-19,2025-05-24,Lidl
Combino Bio Dinkel Nudeln (Bioland  versch. Sorten  Je 500 g),Lebensmittel,Pasta,1.45,2025-05-19,2025-05-24,Lidl
Metzgerfrisch Frische Schweine-Schälrippchen (XXL  Ca. 1.8 kg  kg-Preis),Lebensmittel,Fleisch/Schwein,4.29,2025-05-22,2025-05-24,Lidl
Metzgerfrisch Premium US Chuck-Eye-Steak (Ca. 400 g  Aktion z.B. 400g),Lebensmittel,Fleisch/Rind,8.00,2025-05-22,2025-05-24,Lidl
Olivia Frisches ganzes Kaninchen (Ca. 1.2 kg  kg-Preis),Lebensmittel,Fleisch/Kaninchen,9.99,2025-05-22,2025-05-24,Lidl
Metzgerfrisch Frischer Puten-Schenkel (HKL A  Ca. 2.5 kg  kg-Preis),Lebensmittel,Fleisch/Geflügel,3.99,2025-05-22,2025-05-24,Lidl
Metzgerfrisch Ganzes Hähnchen (gewürzt  Je 1.4 kg),Lebensmittel,Fleisch/Geflügel,5.99,2025-05-22,2025-05-24,Lidl
Grillmeister Schweinenackensteaks (mariniert  versch. Sorten  Je 1 kg),Lebensmittel,Fleisch/Schwein,6.49,2025-05-22,2025-05-24,Lidl
Metzgerfrisch Frisches Hähnchen-Hackfleisch (gewürzt  Je 800 g),Lebensmittel,Fleisch/Geflügel,4.99,2025-05-22,2025-05-24,Lidl
Metzgerfrisch Cordon Bleu-Schnitte (vom Schwein  XXL  Je 1 kg),Lebensmittel,Fleisch/Schwein,6.99,2025-05-22,2025-05-24,Lidl
Fischerstolz MSC Backfisch (XXL  Je 560 g),Lebensmittel,Tiefkühlkost/Fisch,4.99,2025-05-22,2025-05-24,Lidl
Frosta Fertiggerichte (versch. Sorten  Je 500/450 g  Tiefkühlung),Lebensmittel,Tiefkühlkost/Fertiggerichte,2.49,2025-05-22,2025-05-24,Lidl
Schwip Schwap/7UP (versch. Sorten  koffeinhaltig  Je 1.25 l zzgl Pfand),Getränke,Softdrinks,0.79,2025-05-22,2025-05-24,Lidl
Meßmer Cold Tea (versch. Sorten  Je 14x 2.75 g),Getränke,Tee,1.88,2025-05-22,2025-05-24,Lidl
Ariel Waschmittel (Pulver Flüssig oder Pods  Je 90/100/76 WL),Haushalt,Waschmittel,16.99,2025-05-22,2025-05-24,Lidl
Hilcona Teigwaren Mega-Pack (versch. Sorten  Je 750 g  Kühlung),Lebensmittel,Pasta/Fertiggerichte,3.29,2025-05-22,2025-05-24,Lidl
Bens Original Express Reis/Sauce Süß-Sauer (versch. Sorten  Je 220/400/395 g  Lidl Plus),Lebensmittel,Fertiggerichte/Reis/Saucen,1.59,2025-05-22,2025-05-24,Lidl
Nautica ASC Party-Garnelen (Je 100 g  Kühlung  Lidl Plus),Lebensmittel,Fisch/Meeresfrüchte,1.49,2025-05-22,2025-05-24,Lidl
Lays Chips (versch. Sorten  Je 150 g),Lebensmittel,Snacks/Chips,1.19,2025-05-22,2025-05-24,Lidl
Ültje Erdnüsse (versch. Sorten  Je 180 g),Lebensmittel,Snacks/Nüsse,1.69,2025-05-22,2025-05-24,Lidl
Meggle Kräuterbutter (versch. Sorten  Je 5x 20 g  Kühlung  Lidl Plus),Lebensmittel,Milchprodukte/Butter,1.49,2025-05-22,2025-05-24,Lidl
Freeway Limonaden (versch. Sorten  Je 1.5 l zzgl Pfand),Getränke,Softdrinks,0.69,2025-05-22,2025-05-24,Lidl
Somersby Cider (versch. Sorten  enthält Alkohol  Je 0.5 l zzgl Pfand),Getränke,Alkoholische Getränke/Cider,1.49,2025-05-22,2025-05-24,Lidl
Ehrmann Almighurt (versch. Sorten  Je 150 g  Kühlung  Lidl Plus),Lebensmittel,Milchprodukte/Joghurt,0.39,2025-05-22,2025-05-24,Lidl
Always Ultra Binden (versch. Sorten  Je 4x12/4x8/4x14/4x9/4x10 Stück),Drogerie,Hygieneartikel,7.49,2025-05-22,2025-05-24,Lidl
Finish Powerball-Tabs (versch. Sorten  Je 94/78/88 Stück),Haushalt,Geschirrspülmittel,12.99,2025-05-22,2025-05-24,Lidl
Delverde Pasta (versch. Sorten  Je 1 kg  Lidl Plus),Lebensmittel,Pasta,1.99,2025-05-22,2025-05-24,Lidl
Grillmeister Hähnchen-Minutenschnitzel (mariniert  versch. Sorten  Je 400 g),Lebensmittel,Fleisch/Geflügel,3.99,2025-05-23,2025-05-24,Lidl
Meggle Baguette (versch. Sorten  Je 160 g  Kühlung),Lebensmittel,Backwaren/Baguette,1.11,2025-05-23,2025-05-24,Lidl
Gazi Grill- und Pfannenkäse (versch. Sorten  Je 2x 100 g  Kühlung),Lebensmittel,Milchprodukte/Käse,1.79,2025-05-23,2025-05-24,Lidl
Leerdammer Käsescheiben (versch. Sorten  Je 140/125/100 g  Kühlung),Lebensmittel,Milchprodukte/Käse,1.69,2025-05-23,2025-05-24,Lidl
Formil Vollwaschmittel (Je 30 WL  Lidl Plus),Haushalt,Waschmittel,3.99,2025-05-23,2025-05-24,Lidl
Langnese Cremissimo (Bourbon Vanille 1300ml oder Haselnuss Vanilla Schokolade 1000ml) Becher,Lebensmittel,Tiefkühlkost/Eis,1.79,2025-05-19,2025-05-24,Rewe
REWE Beste Wahl Bananen je 1kg,Lebensmittel,Obst & Gemüse,1.79,2025-05-19,2025-05-24,Rewe
Hackfleisch gemischt (Rind und Schwein) je 1kg,Lebensmittel,Fleisch & Wurst,10.96,2025-05-19,2025-05-24,Rewe
Katjes Fruchtgummi (versch. Sorten) je 175g Btl.,Lebensmittel,Süßwaren,0.59,2025-05-19,2025-05-24,Rewe
Freixenet Sekt (versch. Sorten) je 0.75L Fl.,Getränke,Alkoholische Getränke/Sekt,3.88,2025-05-19,2025-05-24,Rewe
Einbecker Brauherren (versch. Sorten) je 20x0.33L Fl. Kasten zzgl. 3.10 Pfand,Getränke,Alkoholische Getränke/Bier,10.99,2025-05-19,2025-05-24,Rewe
Müller Müllermilch (versch. Sorten) je 400ml Fl. zzgl. 0.25 Pfand,Lebensmittel,Milchprodukte/Getränke,0.79,2025-05-19,2025-05-24,Rewe
Zott Sahne Joghurt (versch. Sorten) je 150g Becher,Lebensmittel,Milchprodukte/Joghurt,0.39,2025-05-19,2025-05-24,Rewe
Bahlsen Pick Up! (versch. Sorten) je 5x28g Pckg.,Lebensmittel,Süßwaren/Kekse,1.79,2025-05-19,2025-05-24,Rewe
Fol Epi Classic frz. Schnittkäse je 150g Pckg.,Lebensmittel,Milchprodukte/Käse,1.49,2025-05-19,2025-05-24,Rewe
Rügenwalder Mühlen Schnitzel (2x90g Pckg.) oder Vegane Mühlen Cordon Bleu (2x100g Pckg.),Lebensmittel,Fleischersatz/Fertiggerichte,2.49,2025-05-19,2025-05-24,Rewe
Nuii Ice Cream (Salted Caramel & Australian Macadamia 3x90ml Pckg.) oder Schöller Multipackung Pirulo Watermelon (365ml Pckg.),Lebensmittel,Tiefkühlkost/Eis,1.99,2025-05-19,2025-05-24,Rewe
Thomy Delikatess Mayonnaise (200ml Tube) oder Delikatess-Mayonnaise (250ml Glas),Lebensmittel,Saucen & Dressings,1.69,2025-05-19,2025-05-24,Rewe
Lorenz Pommels (75g Btl.) oder Crunchips Paprika (150g Btl.),Lebensmittel,Snacks/Chips,1.11,2025-05-19,2025-05-24,Rewe
Thomy Delikatess Senf mittelscharf je 200ml Tube,Lebensmittel,Saucen & Dressings,0.99,2025-05-19,2025-05-24,Rewe
Fuze Tea (versch. Sorten) je 1.25L Fl. zzgl. 0.25 Pfand,Getränke,Eistee/Softdrinks,1.29,2025-05-19,2025-05-24,Rewe
Fa Deospray (versch. Sorten) je 150ml Dose,Drogerie,Körperpflege/Deo,1.29,2025-05-19,2025-05-24,Rewe
Powerade (versch. Sorten) je 0.5L Fl. zzgl. 0.25 Pfand,Getränke,Sportgetränke/Softdrinks,0.99,2025-05-19,2025-05-24,Rewe
Ariel Vollwaschmittel Pulver (18WL Pckg.) oder Colorwaschmittel flüssig (20WL Fl.),Haushalt,Waschmittel,4.99,2025-05-19,2025-05-24,Rewe
Neuseeland Zespri Sungold Kiwi Kl. I je St.,Lebensmittel,Obst & Gemüse,0.59,2025-05-24,2025-05-24,Rewe
Möhrenstifte je 200g Btl.,Lebensmittel,Obst & Gemüse,0.79,2025-05-19,2025-05-24,Rewe
REWE to go Sunrise Mix je 175g Becher,Lebensmittel,Obst & Gemüse/Convenience,1.59,2025-05-19,2025-05-24,Rewe
Spanien/Marokko/Portugal Himbeeren Kl. I je 250g Schale,Lebensmittel,Obst & Gemüse,2.79,2025-05-19,2025-05-24,Rewe
Pahmeyer Schinken-Rösti (240g Schale) oder Mini Reibekuchen (300g Schale),Lebensmittel,Fertiggerichte/Beilagen,1.79,2025-05-19,2025-05-24,Rewe
Bubble Tea (versch. Sorten) je 500ml Becher zzgl. 0.25 Pfand,Getränke,Softdrinks,3.99,2025-05-19,2025-05-24,Rewe
Innocent Saft Orange ohne Fruchtfleisch (330ml Fl. zzgl. 0.25 Pfand) oder Smoothie Mango Maracuja (250ml Fl. zzgl. 0.25 Pfand),Getränke,Säfte/Smoothies,1.49,2025-05-19,2025-05-24,Rewe
Marokko Cherry Romatomaten Kl. I je 250g Schale,Lebensmittel,Obst & Gemüse,0.79,2025-05-19,2025-05-24,Rewe
Deutschland Eisbergsalat Kl. I je St.,Lebensmittel,Obst & Gemüse,0.75,2025-05-19,2025-05-24,Rewe
Spanien Gelb- oder weißfleischige Pfirsiche Kl. I je 1kg Schale,Lebensmittel,Obst & Gemüse,1.99,2025-05-19,2025-05-24,Rewe
Deutschland Speisemöhren Kl. I je 1.5kg Btl.,Lebensmittel,Obst & Gemüse,1.11,2025-05-19,2025-05-24,Rewe
Niederlande/Belgien Rispentomaten Kl. I je 1kg,Lebensmittel,Obst & Gemüse,0.99,2025-05-19,2025-05-24,Rewe
Deutschland Rhabarber Kl. I je 750g Pckg.,Lebensmittel,Obst & Gemüse,1.79,2025-05-19,2025-05-24,Rewe
Deutschland Kohlrabi Kl. I je St.,Lebensmittel,Obst & Gemüse,0.49,2025-05-19,2025-05-24,Rewe
Niederlande Rote Paprika Kl. I je 500g Pckg.,Lebensmittel,Obst & Gemüse,1.49,2025-05-19,2025-05-24,Rewe
Italien/Frankreich Rote Tafeläpfel Cripps Pink Kl. I je 1kg/1kg Schale,Lebensmittel,Obst & Gemüse,2.49,2025-05-19,2025-05-24,Rewe
REWE Beste Wahl Frankreich Schalotten Kl. I je 250g Netz,Lebensmittel,Obst & Gemüse,0.89,2025-05-19,2025-05-24,Rewe
REWE Bio Deutschland Bio Basilikum je Topf,Lebensmittel,Obst & Gemüse/Kräuter,1.79,2025-05-19,2025-05-24,Rewe
Spanien Wassermelone kernarm Kl. I je 1kg,Lebensmittel,Obst & Gemüse,1.29,2025-05-19,2025-05-24,Rewe
REWE Feine Welt Deutschland Portobello Pilze Kl. II je 200g Schale,Lebensmittel,Obst & Gemüse,2.79,2025-05-19,2025-05-24,Rewe
Spanien Knoblauch Kl. I je 200g Netz,Lebensmittel,Obst & Gemüse,0.99,2025-05-19,2025-05-24,Rewe
REWE Regional Deutschland Erdbeeren Kl. I je 1kg,Lebensmittel,Obst & Gemüse,Frischepreis im Markt,2025-05-19,2025-05-24,Rewe
Peru Granatapfel Kl. I je St.,Lebensmittel,Obst & Gemüse,1.99,2025-05-19,2025-05-24,Rewe
REWE Beste Wahl Israel Speisekartoffeln Venezia festkochend Qual. I je 1.5kg Btl.,Lebensmittel,Obst & Gemüse,2.22,2025-05-19,2025-05-24,Rewe
Frisches Hähnchen-Brustfilet Teilstück SB-verpackt je 1kg,Lebensmittel,Fleisch & Wurst/Geflügel,9.90,2025-05-19,2025-05-24,Rewe
Nature & Respect Hähnchenschenkel mit Paprika-Chili Marinade SB-verpackt je 1kg,Lebensmittel,Fleisch & Wurst/Geflügel,9.90,2025-05-19,2025-05-24,Rewe
Matthews Hähnchen-Kasseler 2% Fett je 150g Pckg.,Lebensmittel,Fleisch & Wurst/Geflügel,2.22,2025-05-19,2025-05-24,Rewe
ja! Frische Hähnchen-Flügel natur Hkl. A SB-verpackt je 1kg,Lebensmittel,Fleisch & Wurst/Geflügel,5.80,2025-05-19,2025-05-24,Rewe
Entrecôte vom Jungbullen am Stück oder in Scheiben je 100g (Bedienungstheke),Lebensmittel,Fleisch & Wurst/Rind,2.44,2025-05-19,2025-05-24,Rewe
Rinder-Braten aus dem Vorderviertel je 100g (Bedienungstheke),Lebensmittel,Fleisch & Wurst/Rind,1.29,2025-05-19,2025-05-24,Rewe
Kalbs-Steaks aus dem Rücken je 100g (Bedienungstheke),Lebensmittel,Fleisch & Wurst/Kalb,2.99,2025-05-19,2025-05-24,Rewe
REWE Regional Schweine-Stielkotelett je 100g (Bedienungstheke),Lebensmittel,Fleisch & Wurst/Schwein,0.77,2025-05-19,2025-05-24,Rewe
Butchers Barbecue Schweine-Bauchscheiben ohne Knochen (versch. Marinaden) je 400g Pckg.,Lebensmittel,Fleisch & Wurst/Schwein,3.99,2025-05-19,2025-05-24,Rewe
Butchers Barbecue Merguez Rinder-Bratwurst je 250g Pckg.,Lebensmittel,Fleisch & Wurst/Rind,3.33,2025-05-19,2025-05-24,Rewe
