Produktname,Kategorie,Unterkategorie,Preis_EUR,Startdatum,Enddatum,Supermarkt
Weideglück Donautaler Butterkäse Schnittkäse mind. 45% Fett i.Tr. je 100g (Bedienungstheke),Lebensmittel,Milchprodukte/Käse,0.89,2025-05-19,2025-05-24,Rewe
Käserei Champignon Cambozola oder Rougette Weichkäse (versch. Sorten) je 100g (Bedienungstheke),Lebensmittel,Milchprodukte/Käse,1.69,2025-05-19,2025-05-24,Rewe
Westland Old Amsterdam holl. Hartkäse 48% Fett i.Tr. je 100g (Bedienungstheke),Lebensmittel,Milchprodukte/Käse,1.69,2025-05-19,2025-05-24,Rewe
Timmendorfer Matrosenwurst oder Riesen-Matrosenwurst je 100g (Bedienungstheke),Lebensmittel,Fleisch & Wurst/Wurst,1.99,2025-05-19,2025-05-24,Rewe
Berger Beinschinken je 100g (Bedienungstheke),Lebensmittel,Fleisch & Wurst/Schinken,1.79,2025-05-19,2025-05-24,Rewe
Reinert Klosterschinken je 100g (Bedienungstheke),Lebensmittel,Fleisch & Wurst/Schinken,1.79,2025-05-19,2025-05-24,Rewe
Pick Salami oder Paprika-Kolbasz original ungarisch je 100g (Bedienungstheke),Lebensmittel,Fleisch & Wurst/Wurst,2.49,2025-05-19,2025-05-24,Rewe
Balzer Hähnchengrillbrust je 100g (Bedienungstheke),Lebensmittel,Fleisch & Wurst/Geflügel,1.59,2025-05-19,2025-05-24,Rewe
Gutfried Geflügel-Aufschnitt (versch. Sorten) je 100g (Bedienungstheke),Lebensmittel,Fleisch & Wurst/Geflügel,1.49,2025-05-19,2025-05-24,Rewe
Wilhelm Brandenburg Leberwurst mit Kalbfleisch je 100g (Bedienungstheke),Lebensmittel,Fleisch & Wurst/Wurst,0.99,2025-05-19,2025-05-24,Rewe
Wiesenhof Geflügel Mortadella (versch. Sorten) je 100g Pckg.,Lebensmittel,Fleisch & Wurst/Geflügel,1.29,2025-05-19,2025-05-24,Rewe
Tulip Bacon in Scheiben je 125g Pckg.,Lebensmittel,Fleisch & Wurst/Speck,1.49,2025-05-19,2025-05-24,Rewe
Elpozo Original Fuetec Spanische Salami luftgetr. (170g Pckg.) oder Iberico Fuetec Spanische Salami (150g Pckg.),Lebensmittel,Fleisch & Wurst/Wurst,2.99,2025-05-19,2025-05-24,Rewe
Rügenwalder Mühlen Mett oder Mühlen Schinken je 100g Pckg.,Lebensmittel,Fleisch & Wurst/Wurst,1.79,2025-05-19,2025-05-24,Rewe
Patros Grill & Ofen Kräuter Weichkäse (150g Pckg.) oder Patros Natur Weichkäse (180g Pckg.),Lebensmittel,Milchprodukte/Käse,1.79,2025-05-19,2025-05-24,Rewe
Géramont Scheiben mit Skyr (150g Pckg.) oder Weichkäse (200g Pckg.),Lebensmittel,Milchprodukte/Käse,2.29,2025-05-19,2025-05-24,Rewe
Hochland Almette Frischkäse (versch. Sorten) je 150g Pckg.,Lebensmittel,Milchprodukte/Frischkäse,0.99,2025-05-19,2025-05-24,Rewe
Leicht & Cross Knusperbrot (versch. Sorten) je 125g Pckg.,Lebensmittel,Brot & Backwaren,0.99,2025-05-19,2025-05-24,Rewe
REWE Beste Wahl Dinkelsauerteigbrötchen zum Fertigbacken je 340g Pckg.,Lebensmittel,Brot & Backwaren,1.99,2025-05-19,2025-05-24,Rewe
Feigenbrot je 330g St.,Lebensmittel,Brot & Backwaren,1.79,2025-05-19,2025-05-24,Rewe
Kerrygold extra (versch. Sorten) je 400g Becher,Lebensmittel,Milchprodukte/Butter & Margarine,3.19,2025-05-19,2025-05-24,Rewe
Emmi Caffè Latte (versch. Sorten koffeinhaltig) je 230ml Becher,Getränke,Kaffeegetränke/Milchprodukte,1.29,2025-05-19,2025-05-24,Rewe
Bärenmarke Frisch- oder H-Milch (versch. Sorten 3.8% Fett) je 1L Pckg.,Lebensmittel,Milchprodukte/Milch,1.11,2025-05-19,2025-05-24,Rewe
Lätta Original je 450g Becher,Lebensmittel,Milchprodukte/Butter & Margarine,1.19,2025-05-19,2025-05-24,Rewe
Dr. Oetker Rotwein Mousse (100g Becher) oder Götterspeise Waldmeister mit Bourbon-Vanillesoße (160g Becher),Lebensmittel,Milchprodukte/Desserts,0.69,2025-05-19,2025-05-24,Rewe
Andechser Natur Bio Jogurt mild 3.8% Fett je 500g Becher,Lebensmittel,Milchprodukte/Joghurt,1.11,2025-05-19,2025-05-24,Rewe
Weihenstephan Cremig & Quarkig (versch. Sorten) je 500g Becher,Lebensmittel,Milchprodukte/Quark,1.69,2025-05-19,2025-05-24,Rewe
Popp Brotaufstrich (versch. Sorten) je 150g Becher,Lebensmittel,Brotaufstriche/Feinkost,0.99,2025-05-19,2025-05-24,Rewe
Kiri Dippi (105g Pckg.) oder Portionen (108g Pckg.),Lebensmittel,Milchprodukte/Käse,1.99,2025-05-19,2025-05-24,Rewe
Zott Monte Maxi Schoko je 4x100g Becher,Lebensmittel,Milchprodukte/Desserts,1.49,2025-05-19,2025-05-24,Rewe
Iglo Filegro Ofen-Backfisch (tiefgefroren 240g Pckg.) oder Schlemmerfilet Bordelaise Classic (tiefgefroren 380g Pckg.),Lebensmittel,Tiefkühlkost/Fisch,2.69,2025-05-19,2025-05-24,Rewe
Followfood Bio Lachs Filets tiefgefroren je 200g Pckg.,Lebensmittel,Tiefkühlkost/Fisch,7.99,2025-05-19,2025-05-24,Rewe
Wagner Die Backfrische Mozzarella (tiefgefroren 350g Pckg.) oder Big City Pizza Budapest (tiefgefroren 400g Pckg.),Lebensmittel,Tiefkühlkost/Pizza,1.99,2025-05-19,2025-05-24,Rewe
Wagner Creazione Salame & Nduja Tipo (tiefgefroren 430g Pckg.) oder Creazione Caprese (tiefgefroren 435g Pckg.),Lebensmittel,Tiefkühlkost/Pizza,4.49,2025-05-19,2025-05-24,Rewe
Dovgan Pelmeni Teigtaschen mit Putenfleisch tiefgefroren je 500g Btl.,Lebensmittel,Tiefkühlkost/Fertiggerichte,1.99,2025-05-19,2025-05-24,Rewe
Iglo Gemüse-Ideen Italienisch (tiefgefroren 480g Pckg.) oder Rahm-Königsgemüse (tiefgefroren 500g Pckg.),Lebensmittel,Tiefkühlkost/Gemüse,2.22,2025-05-19,2025-05-24,Rewe
Omami Tofu (versch. Sorten) je 200g Pckg.,Lebensmittel,Vegetarisch & Vegan/Tofu,2.19,2025-05-19,2025-05-24,Rewe
Homann Kartoffelsalat (versch. Sorten) je 400g Pckg.,Lebensmittel,Feinkost/Salate,1.79,2025-05-19,2025-05-24,Rewe
Meica Curry King (versch. Sorten) je 220g Pckg.,Lebensmittel,Fertiggerichte/Konserven,1.79,2025-05-19,2025-05-24,Rewe
Block House Brot Knoblauch (250g Pckg.) oder Brot Kräuterbutter (254g Pckg.),Lebensmittel,Brot & Backwaren,1.99,2025-05-19,2025-05-24,Rewe
ja! Vanille Erdbeer Hörnchen je 6x120ml Pckg.,Lebensmittel,Tiefkühlkost/Eis,1.99,2025-05-19,2025-05-24,Rewe
ja! Gelierzucker 2:1 je 500g Pckg.,Lebensmittel,Backzutaten,0.79,2025-05-19,2025-05-24,Rewe
ja! Reine Buttermilch je 500g Becher,Lebensmittel,Milchprodukte/Milch,0.59,2025-05-19,2025-05-24,Rewe
ja! Party-Nüsse Paprika je 200g Btl.,Lebensmittel,Snacks/Nüsse,1.29,2025-05-19,2025-05-24,Rewe
ja! Wurstsalat Schweizer Art je 300g Becher,Lebensmittel,Feinkost/Salate,1.99,2025-05-19,2025-05-24,Rewe
ja! Butter-Toastbrot je 500g Pckg.,Lebensmittel,Brot & Backwaren,0.79,2025-05-19,2025-05-24,Rewe
ja! Kroketten für Backofen und Pfanne tiefgefroren je 750g Pckg.,Lebensmittel,Tiefkühlkost/Beilagen,1.79,2025-05-19,2025-05-24,Rewe
ja! Mozzarella 45% Fett i.Tr. 125g Abtropfgew. je 200g Btl.,Lebensmittel,Milchprodukte/Käse,0.85,2025-05-19,2025-05-24,Rewe
ja! Frische Salatschale (versch. Sorten) je 300g Schale,Lebensmittel,Feinkost/Salate,2.49,2025-05-19,2025-05-24,Rewe
Nordlicht Landbier mild oder Pilsener je 0.5L Dose zzgl. 0.25 Pfand,Getränke,Alkoholische Getränke/Bier,0.59,2025-05-19,2025-05-24,Rewe
Nordlicht Landbier mild Radler oder Pilsener je 6x0.33L Fl. Sixpack zzgl. 0.48 Pfand,Getränke,Alkoholische Getränke/Bier,3.29,2025-05-19,2025-05-24,Rewe
Nordlicht Rostbratwurst mit Bacon je 360g Pckg.,Lebensmittel,Fleisch & Wurst/Wurst,3.99,2025-05-19,2025-05-24,Rewe
Nordlicht Alkoholfrei oder Radler je 0.33L Dose zzgl. 0.25 Pfand,Getränke,Alkoholische Getränke/Bier,0.49,2025-05-19,2025-05-24,Rewe
Nordlicht Landbier mild je 20x0.33L Fl. Kasten zzgl. 3.10 Pfand,Getränke,Alkoholische Getränke/Bier,7.77,2025-05-19,2025-05-24,Rewe
Nordlicht Bierbeißer (versch. Sorten) je 150g Pckg.,Lebensmittel,Snacks/Fleischsnacks,2.49,2025-05-19,2025-05-24,Rewe
Butchers Barbecue Schweine-Nackensteaks (in versch. Marinaden) je 380g Pckg.,Lebensmittel,Fleisch & Wurst/Schwein,4.49,2025-05-19,2025-05-24,Rewe
Butchers Barbecue Schweine-Grillfackeln mit Smoked Paprika Marinade je 450g Pckg.,Lebensmittel,Fleisch & Wurst/Schwein,5.99,2025-05-19,2025-05-24,Rewe
Butchers Barbecue Hüftsteaks (versch. Marinaden) je 300g Pckg.,Lebensmittel,Fleisch & Wurst/Schwein,3.49,2025-05-19,2025-05-24,Rewe
Butchers Barbecue Hähnchen-Spieße aus der Oberkeule mit Mango-Skyr-Marinade SB-verpackt je 1kg Pckg.,Lebensmittel,Fleisch & Wurst/Geflügel,14.90,2025-05-19,2025-05-24,Rewe
Butchers Barbecue Hähnchen-Spieße in Korean BBQ Marinade SB-verpackt je 1kg,Lebensmittel,Fleisch & Wurst/Geflügel,15.90,2025-05-19,2025-05-24,Rewe
Butchers Barbecue Grillmais (versch. Sorten) je 420g Pckg.,Lebensmittel,Gemüse/Beilagen,1.99,2025-05-19,2025-05-24,Rewe
Vilsa Bio Mineralwasser (versch. Sorten) je 12x0.7L Fl. Kasten zzgl. 3.30 Pfand,Getränke,Wasser,4.99,2025-05-19,2025-05-24,Rewe
Coca-Cola (versch. Sorten teilw. koffeinhaltig) je 6x1L Glasfl. Kasten zzgl. 2.40 Pfand,Getränke,Softdrinks,7.99,2025-05-19,2025-05-24,Rewe
Paulaner Spezi oder Spezi Zero koffeinhaltig je 20x0.5L Fl. Kasten zzgl. 3.10 Pfand,Getränke,Softdrinks,10.99,2025-05-19,2025-05-24,Rewe
Sinalco Limonade (versch. Sorten teilw. koffeinhaltig) je 12x1L Fl. Kasten zzgl. 3.30 Pfand,Getränke,Softdrinks,7.99,2025-05-19,2025-05-24,Rewe
Franziskaner Weissbier (versch. Sorten) je 20x0.5L Fl. Kasten zzgl. 3.10 Pfand,Getränke,Alkoholische Getränke/Bier,12.99,2025-05-19,2025-05-24,Rewe
Jägermeister Kräuterlikör oder Orange (35/33% Vol.) je 0.7L Fl.,Getränke,Alkoholische Getränke/Spirituosen,11.49,2025-05-19,2025-05-24,Rewe
Jack Daniels Tennessee Whiskey 40% Vol. je 0.7L Fl.,Getränke,Alkoholische Getränke/Spirituosen,14.99,2025-05-19,2025-05-24,Rewe
Jim Beam Premium Longdrinks (versch. Sorten teilw. koffeinhaltig 10% Vol) je 0.33L Dose zzgl. 0.25 Pfand,Getränke,Alkoholische Getränke/Mischgetränke,1.99,2025-05-19,2025-05-24,Rewe
Deit Orangen- oder Zitronen-Limonade (versch. Sorten) je 12x1L Fl. Kasten zzgl. 3.30 Pfand,Getränke,Softdrinks,8.49,2025-05-19,2025-05-24,Rewe
Coca-Cola (versch. Sorten teilw. koffeinhaltig) je 24x0.33L Glasfl. Kasten zzgl. 5.10 Pfand,Getränke,Softdrinks,15.99,2025-05-19,2025-05-24,Rewe
Radeberger Pilsner je 20x0.5L Fl. Kasten zzgl. 3.10 Pfand,Getränke,Alkoholische Getränke/Bier,10.79,2025-05-19,2025-05-24,Rewe
Paulaner Weißbier (versch. Sorten) je 20x0.5L Fl. Kasten zzgl. 3.10 Pfand,Getränke,Alkoholische Getränke/Bier,13.99,2025-05-19,2025-05-24,Rewe
Heineken Premium Beer je 20x0.4L oder 28x0.25L Fl. Kasten zzgl. 3.10/3.74 Pfand,Getränke,Alkoholische Getränke/Bier,14.99,2025-05-19,2025-05-24,Rewe
Krombacher Pils Frischefass je 5L Dose,Getränke,Alkoholische Getränke/Bier,9.99,2025-05-19,2025-05-24,Rewe
Ramazzotti Amaro 30% Vol. je 0.7L Fl.,Getränke,Alkoholische Getränke/Spirituosen,9.99,2025-05-19,2025-05-24,Rewe
Coca-Cola (versch. Sorten teilw. koffeinhaltig) je 1.5L Fl. zzgl. 0.25 Pfand,Getränke,Softdrinks,1.19,2025-05-19,2025-05-24,Rewe
Hohes C Saft (versch. Sorten ausg. 100% Orangensäfte) je 1L Fl. zzgl. 0.25 Pfand,Getränke,Säfte,1.79,2025-05-19,2025-05-24,Rewe
Hella Mineralwasser (versch. Sorten) je 6x1.5L Fl. Pckg. zzgl. 1.50 Pfand,Getränke,Wasser,3.00,2025-05-19,2025-05-24,Rewe
Heineken Premium Beer (versch. Sorten) je 6x0.33L Fl. Sixpack zzgl. 0.48 Pfand,Getränke,Alkoholische Getränke/Bier,4.99,2025-05-19,2025-05-24,Rewe
Karlsberg Mixery (versch. Sorten teilw. koffeinhaltig) je 0.5L Dose zzgl. 0.25 Pfand,Getränke,Alkoholische Getränke/Mischgetränke,0.99,2025-05-19,2025-05-24,Rewe
Granini Die Limo (versch. Sorten je 1L Fl. zzgl. 0.25 Pfand) oder Fresh (versch. Sorten je 0.75L Fl. zzgl. 0.25 Pfand),Getränke,Softdrinks/Säfte,1.29,2025-05-19,2025-05-24,Rewe
Oettinger Pils oder Export je 20x0.5L Fl. Kasten zzgl. 3.10 Pfand,Getränke,Alkoholische Getränke/Bier,6.99,2025-05-19,2025-05-24,Rewe
Veltins Pilsener je 24x0.33L oder 20x0.5L Fl. Kasten zzgl. 3.42/3.10 Pfand,Getränke,Alkoholische Getränke/Bier,10.99,2025-05-19,2025-05-24,Rewe
Hohes C Vitamin Water (versch. Sorten) je 0.75L Fl. zzgl. 0.25 Pfand,Getränke,Wasser/Vitaminwasser,1.39,2025-05-19,2025-05-24,Rewe
Veltins Helles Pülleken je 24x0.33L Fl. Kasten zzgl. 3.42 Pfand,Getränke,Alkoholische Getränke/Bier,13.99,2025-05-19,2025-05-24,Rewe
Erdinger Weißbier oder Brauhaus je 20x0.5L Fl. Kasten zzgl. 3.10 Pfand,Getränke,Alkoholische Getränke/Bier,14.99,2025-05-19,2025-05-24,Rewe
Havana Club Añejo 3 Años (37.5% Vol.) oder Mango Lime (30% Vol.) je 0.7L Fl.,Getränke,Alkoholische Getränke/Spirituosen,10.99,2025-05-19,2025-05-24,Rewe
Nordbrand Nordhausen Pfefferminzlikör 18% Vol. je 0.7L Fl.,Getränke,Alkoholische Getränke/Spirituosen,3.99,2025-05-19,2025-05-24,Rewe
Johnnie Walker Red Label Blended Scotch Whisky 40% Vol. je 0.7L Fl.,Getränke,Alkoholische Getränke/Spirituosen,9.99,2025-05-19,2025-05-24,Rewe
Schierker Feuerstein 35% Vol. je 0.7L Fl.,Getränke,Alkoholische Getränke/Spirituosen,8.99,2025-05-19,2025-05-24,Rewe
Spanien Freixenet Cabernet Sauvignon oder Blanc trocken je 0.75L Fl.,Getränke,Alkoholische Getränke/Wein,3.99,2025-05-19,2025-05-24,Rewe
USA/Kalifornien Gallo Family Vineyards (versch. Sorten) je 0.75L Fl.,Getränke,Alkoholische Getränke/Wein,3.99,2025-05-19,2025-05-24,Rewe
Chantré Weinbrand 36% Vol. je 0.7L Fl.,Getränke,Alkoholische Getränke/Spirituosen,5.99,2025-05-19,2025-05-24,Rewe
Gerstacker Sansibar Hugo oder Bellini je 0.75L Fl.,Getränke,Alkoholische Getränke/Mischgetränke,2.99,2025-05-19,2025-05-24,Rewe
Lillet Berry oder White Peach 10.3% Vol. je 3x0.2L Fl. Pckg.,Getränke,Alkoholische Getränke/Mischgetränke,6.99,2025-05-19,2025-05-24,Rewe
Maggi Fix Lasagne (30g Btl.) oder Herzensküche Würzpaste Spaghetti Bolognese (85g Btl.),Lebensmittel,Fix-Produkte/Würzmittel,0.49,2025-05-19,2025-05-24,Rewe
Hellmanns Tomato Ketchup je 500ml Fl.,Lebensmittel,Saucen & Dressings/Ketchup,1.99,2025-05-19,2025-05-24,Rewe
Bens Original Reis im Kochbeutel (versch. Sorten) je 4x125g Pckg.,Lebensmittel,Reis & Nudeln/Reis,1.79,2025-05-19,2025-05-24,Rewe
Maggi Minions Tomatensuppe (ausr. für 500ml Btl.) oder Guten Appetit Suppe mit Rind (ausr. für 1 Liter Btl.),Lebensmittel,Suppen/Fertiggerichte,0.69,2025-05-19,2025-05-24,Rewe
Knorr Soße 3er-Pack (versch. Sorten ausr. für 3x250ml) je Pckg.,Lebensmittel,Saucen & Dressings/Fix-Produkte,0.99,2025-05-19,2025-05-24,Rewe
Knorr Pasta Pot Käse & Sahne je 63g Becher,Lebensmittel,Fertiggerichte/Snacks,0.99,2025-05-19,2025-05-24,Rewe
3 Glocken Genuss Pur Pasta (versch. Ausformungen) je 500g Btl.,Lebensmittel,Reis & Nudeln/Pasta,0.99,2025-05-19,2025-05-24,Rewe
Rapso Rapsöl 100% rein aus kontrolliertem Anbau je 0.75L Fl.,Lebensmittel,Öle & Fette,3.79,2025-05-19,2025-05-24,Rewe
La Española Natives Olivenöl Extra je 500ml Fl.,Lebensmittel,Öle & Fette,6.99,2025-05-19,2025-05-24,Rewe
Mövenpick Gourmet-Frühstück Fruchtaufstrich (versch. Sorten) je 250g Glas,Lebensmittel,Brotaufstriche/Marmelade,1.99,2025-05-19,2025-05-24,Rewe
Kinder Bueno (10x21.5g Pckg.) oder Schoko-Bons (200g Btl.),Lebensmittel,Süßwaren/Schokolade,2.79,2025-05-19,2025-05-24,Rewe
Storck Knoppers Nussriegel (5x40g Pckg.) oder Knoppers (8x25g Pckg.),Lebensmittel,Süßwaren/Riegel,1.99,2025-05-19,2025-05-24,Rewe
Ritter Sport Schokolade Nussklasse Voll-Nuss je 100g Tafel,Lebensmittel,Süßwaren/Schokolade,1.69,2025-05-19,2025-05-24,Rewe
Schogetten (versch. Sorten) je 100g Tafel,Lebensmittel,Süßwaren/Schokolade,1.29,2025-05-19,2025-05-24,Rewe
Nestlé Kit Kat Mini Mix (197.4g Btl.) oder Smarties mini (201g Btl.),Lebensmittel,Süßwaren/Schokolade,2.79,2025-05-19,2025-05-24,Rewe
Schulte Alpengruss Prussien je 220g Pckg.,Lebensmittel,Süßwaren/Gebäck,1.99,2025-05-19,2025-05-24,Rewe
Teekanne Kräutertee Minze (45g Pckg.) oder Früchtetee Waldbeere (50g Pckg.),Getränke,Tee,1.49,2025-05-19,2025-05-24,Rewe
Nescafé Classic löslicher Bohnenkaffee je 200g Glas,Getränke,Kaffee/Instantkaffee,6.49,2025-05-19,2025-05-24,Rewe
Darboven Eilles Gourmet Café oder Idee Kaffee Classic gemahlener Bohnenkaffee je 500g Pckg.,Getränke,Kaffee/Bohnenkaffee gemahlen,6.49,2025-05-19,2025-05-24,Rewe
Jacobs Barista Editions ganze Bohnen (versch. Sorten) je 1000g Pckg.,Getränke,Kaffee/Bohnenkaffee ganz,12.99,2025-05-19,2025-05-24,Rewe
ZooRoyal Mini Mix Hundesnack je 60g Btl.,Tierbedarf,Hundefutter/Snacks,0.89,2025-05-19,2025-05-24,Rewe
ZooRoyal Hundesnack Hühner- oder Entenbrustfilet je 125g Btl.,Tierbedarf,Hundefutter/Snacks,1.49,2025-05-19,2025-05-24,Rewe
ZooRoyal Hundefutter Pastete (versch. Sorten) je 150g Schale,Tierbedarf,Hundefutter/Nassfutter,0.39,2025-05-19,2025-05-24,Rewe
ZooRoyal Hundenahrung (versch. Sorten) je 400g Dose,Tierbedarf,Hundefutter/Nassfutter,1.19,2025-05-19,2025-05-24,Rewe
ZooRoyal Plüschfuchs je St.,Tierbedarf,Hundespielzeug,6.99,2025-05-19,2025-05-24,Rewe
ZooRoyal Plüschhund je St.,Tierbedarf,Hundespielzeug,3.99,2025-05-19,2025-05-24,Rewe
ZooRoyal Eule mit Katzenminze je St.,Tierbedarf,Katzenspielzeug,2.49,2025-05-19,2025-05-24,Rewe
ZooRoyal Katzenmilch je 2x200ml Pckg.,Tierbedarf,Katzenfutter/Milch & Snacks,0.79,2025-05-19,2025-05-24,Rewe
ZooRoyal Ultra Klumpstreu je 6L Pckg.,Tierbedarf,Katzenstreu,3.49,2025-05-19,2025-05-24,Rewe
ZooRoyal Katzennassfutter 8xGourmet Menü in Gelee je 8x85g Btl.,Tierbedarf,Katzenfutter/Nassfutter,3.19,2025-05-19,2025-05-24,Rewe
ZooRoyal Katzen Schleckies (versch. Sorten) je 8x15g Pckg.,Tierbedarf,Katzenfutter/Snacks,1.19,2025-05-19,2025-05-24,Rewe
ZooRoyal Mäuse mit Rassel je Pckg.,Tierbedarf,Katzenspielzeug,2.99,2025-05-19,2025-05-24,Rewe
ZooRoyal Katzennahrung Wild-Pastete auf Aspik oder Lachs-Pastete mit Joghurtgelee je 100g Schale/Dose,Tierbedarf,Katzenfutter/Nassfutter,10 für 7 Aktion,2025-05-19,2025-05-24,Rewe
Nivea Men Duschgel Sport je 250ml Fl.,Drogerie,Körperpflege/Duschgel,1.99,2025-05-19,2025-05-24,Rewe
Nivea Deo Roll-On Fresh Ocean je 50ml Roller,Drogerie,Körperpflege/Deo,2.99,2025-05-19,2025-05-24,Rewe
Nivea Q10 Anti-Falten Power straffende Tagespflege LSF 15 je 50ml Tiegel,Drogerie,Gesichtspflege,10.99,2025-05-19,2025-05-24,Rewe
Fairy Geschirrspülmittel (versch. Sorten) je 450ml Fl.,Haushalt,Spülmittel,1.29,2025-05-19,2025-05-24,Rewe
Garnier Wahre Schätze Shampoo (versch. Sorten) je 250ml Fl.,Drogerie,Haarpflege/Shampoo,1.99,2025-05-19,2025-05-24,Rewe
Nivea feuchtigkeitsspendende Tagespflege (erfrischend oder reichhaltig) je 50ml Tuben-Pckg.,Drogerie,Gesichtspflege,3.79,2025-05-19,2025-05-24,Rewe
Mr Proper Citrusfrische je 1L Fl.,Haushalt,Reinigungsmittel,1.59,2025-05-19,2025-05-24,Rewe
Colgate Total Zahncreme Original je 75ml Tuben-Pckg.,Drogerie,Mundpflege/Zahnpasta,2.99,2025-05-19,2025-05-24,Rewe
Carefree Slipeinlagen Plus Long (40St. Pckg.) oder Slipeinlagen Cotton Feel Normal (56St. Pckg.),Drogerie,Damenhygiene,1.99,2025-05-19,2025-05-24,Rewe
Lenor Weichspüler (versch. Sorten) je 1239ml Fl.,Haushalt,Waschmittel/Weichspüler,3.29,2025-05-19,2025-05-24,Rewe
ESN Isoclear oder More Protein Iced Coffee (versch. Sorten) je 300g Dose,Lebensmittel,Nahrungsergänzung/Sportnahrung,15.99,2025-05-19,2025-05-24,Rewe
Tena Discreet Einlagen Extra (10St. Pckg.) oder Discreet Ultra Einlagen Normal (16St. Pckg.),Drogerie,Inkontinenzprodukte,2.99,2025-05-19,2025-05-24,Rewe
HARIBO Fruchtgummi (versch. Sorten je 175g),Lebensmittel,Süßwaren,0.79,2025-05-19,2025-05-24,Penny
ARLA Kærgården (versch. Sorten je 200g),Lebensmittel,Molkereiprodukte,1.79,2025-05-19,2025-05-24,Penny
BAUER Fruchtjoghurt (versch. Sorten je 250g),Lebensmittel,Molkereiprodukte,0.44,2025-05-19,2025-05-24,Penny
Frische Hähnchenschenkel (je 2000g Packung),Lebensmittel,Fleisch/Geflügel,6.98,2025-05-19,2025-05-24,Penny
Frische Hähnchenschenkel (App-Preis) (je 2000g Packung),Lebensmittel,Fleisch/Geflügel,5.98,2025-05-19,2025-05-24,Penny
Avocado angereift (Kl. I je Stück),Lebensmittel,Obst,0.79,2025-05-19,2025-05-24,Penny
Marktliebe Rote Spitzpaprika (Kl. I je 500g Packung),Lebensmittel,Gemüse,1.69,2025-05-19,2025-05-24,Penny
Marktliebe REGIONAL Deutscher weißer Spargel (Kl. II je 1kg Bund),Lebensmittel,Gemüse,5.99,2025-05-19,2025-05-24,Penny
Marktliebe Speisefrühkartoffeln Spargelkartoffeln (Festkochend Qualität I je 1.5kg Packung),Lebensmittel,Gemüse,1.99,2025-05-19,2025-05-24,Penny
Marktliebe Speisefrühkartoffeln Spargelkartoffeln (App-Preis) (Festkochend Qualität I je 1.5kg Packung),Lebensmittel,Gemüse,1.79,2025-05-19,2025-05-24,Penny
Marktliebe Mango (Kl. I je Stück),Lebensmittel,Obst,0.79,2025-05-19,2025-05-24,Penny
Marktliebe Grüne Birnen (Sorte Abate Fetel Kl. I je kg),Lebensmittel,Obst,2.22,2025-05-19,2025-05-24,Penny
Nektarinen (Kl. I je 500g Schale),Lebensmittel,Obst,1.49,2025-05-19,2025-05-24,Penny
Wandelröschen (Im 12cm Topf je Stück),Pflanzen,Blumen,2.29,2025-05-19,2025-05-24,Penny
Husarenknöpfchen (Im 12cm Topf je Stück),Pflanzen,Blumen,1.99,2025-05-19,2025-05-24,Penny
Zinnie (Im 12cm Topf je Stück),Pflanzen,Blumen,1.99,2025-05-19,2025-05-24,Penny
Gänseblümchen (Sorte Fresco im 10.5cm Topf je Stück),Pflanzen,Blumen,1.69,2025-05-19,2025-05-24,Penny
Großblumige Goldmarie (Im 12cm Topf je Stück),Pflanzen,Blumen,1.99,2025-05-19,2025-05-24,Penny
Köcherblümchen (Sorte Flory Glory im 12cm Topf je Stück),Pflanzen,Blumen,2.29,2025-05-19,2025-05-24,Penny
Fächerblume (Sorte Fancy im 12cm Topf je Stück),Pflanzen,Blumen,2.29,2025-05-19,2025-05-24,Penny
Lavendel (Sorte Essence purple im 13cm Topf je Stück),Pflanzen,Blumen,1.99,2025-05-19,2025-05-24,Penny
Zauberschnee (Im 12cm Topf je Stück),Pflanzen,Blumen,2.29,2025-05-19,2025-05-24,Penny
MÜHLENHOF REGIONAL Frisches Hähnchen-Geschnetzeltes (Natur je 400g Packung),Lebensmittel,Fleisch/Geflügel,3.79,2025-05-19,2025-05-24,Penny
Frisches Hähnchen-Cordon-bleu (je 245g Packung),Lebensmittel,Fleisch/Geflügel,2.22,2025-05-19,2025-05-24,Penny
Frischer Entenschenkel (versch. Gewichte z.B. 200g),Lebensmittel,Fleisch/Geflügel,1.99,2025-05-19,2025-05-24,Penny
MÜHLENHOF Frische Cevapcici (Vom Rind gewürzt je 280g Packung),Lebensmittel,Fleisch/Wurst,2.99,2025-05-19,2025-05-24,Penny
GRILLPARTY Merguez Bratwurst (nach französischer Art aus Rind- und Lammfleisch je 360g Packung),Lebensmittel,Fleisch/Wurst,3.99,2025-05-19,2025-05-24,Penny
AXEL SCHULZ Cowboy Ribs (Vom Schwein vorgegart mit Axels Soße mariniert je 540g Packung),Lebensmittel,Fleisch/Fertiggerichte,5.99,2025-05-19,2025-05-24,Penny
BÖKLUNDER Wiener Würstchen (je 475g Abtropfgewicht 210g),Lebensmittel,Wurst,2.49,2025-05-19,2025-05-24,Penny
MÜHLENHOF XXL Wiener Würstchen (je 800g),Lebensmittel,Wurst,4.49,2025-05-19,2025-05-24,Penny
HAUSMARKE GRILL BACON (versch. Sorten je 250g),Lebensmittel,Wurst,2.99,2025-05-19,2025-05-24,Penny
KÖNECKE Hähnchenwurst (versch. Sorten je 140g),Lebensmittel,Wurst,1.79,2025-05-19,2025-05-24,Penny
JACK LINK'S Beef Jerky (versch. Sorten je 60g),Lebensmittel,Snacks/Fleisch,2.99,2025-05-19,2025-05-24,Penny
AOSTE Stickado-Brot (je 90g) oder Stickado (versch. Sorten je 70g),Lebensmittel,Snacks/Wurst,1.79,2025-05-19,2025-05-24,Penny
MC CAIN Golden Longs Pommes frites (mit Knuspermantel je 1000g),Lebensmittel,Tiefkühlkost/Beilagen,2.99,2025-05-19,2025-05-24,Penny
ORIGINAL WAGNER Piccolinis (Brezel Rustikal je 243g oder Salami je 270g),Lebensmittel,Tiefkühlkost/PizzaSnacks,1.99,2025-05-19,2025-05-24,Penny
ORIGINAL WAGNER Piccolinis (App-Preis) (Brezel Rustikal je 243g oder Salami je 270g),Lebensmittel,Tiefkühlkost/PizzaSnacks,1.79,2025-05-19,2025-05-24,Penny
GUSTAVO GUSTO Pizza (Quattro Formaggi je 430g oder Margherita je 410g),Lebensmittel,Tiefkühlkost/Pizza,3.49,2025-05-19,2025-05-24,Penny
PATROS Grill- und Ofenkäse (versch. Sorten je 150g) oder Hirtenkäse (Natur je 180g),Lebensmittel,Molkereiprodukte/Käse,1.79,2025-05-19,2025-05-24,Penny
KERRYGOLD Reibekäse oder Cheddar Scheiben (versch. Sorten je 150g),Lebensmittel,Molkereiprodukte/Käse,1.49,2025-05-19,2025-05-24,Penny
PHILADELPHIA Frischkäsezubereitung (Kräuter oder Natur je 265g),Lebensmittel,Molkereiprodukte/Frischkäse,1.69,2025-05-19,2025-05-24,Penny
MILKANA Tolle Rolle (je 100g) oder Schmelzkäse (versch. Sorten je 190g),Lebensmittel,Molkereiprodukte/Käse,1.99,2025-05-19,2025-05-24,Penny
DELI REFORM Margarine (versch. Sorten je 500g),Lebensmittel,Margarine/Fette,1.29,2025-05-19,2025-05-24,Penny
ZOTT Monte Waffelhörnchen (je 480ml),Lebensmittel,Tiefkühlkost/Eis,2.99,2025-05-19,2025-05-24,Penny
SCHÖLLER Eis (Big Sandwich je 840ml oder Kaktus je 9x45ml),Lebensmittel,Tiefkühlkost/Eis,3.99,2025-05-19,2025-05-24,Penny
SCHÖLLER Eis (App-Preis) (Big Sandwich je 840ml oder Kaktus je 9x45ml),Lebensmittel,Tiefkühlkost/Eis,1.99,2025-05-19,2025-05-24,Penny
DANONE Fruchtzwerge XXL (versch. Sorten je 6x100g),Lebensmittel,Molkereiprodukte/Joghurt,2.88,2025-05-19,2025-05-24,Penny
EHRMANN Vanille- Früchte- oder Grießtraum (versch. Sorten je 115g),Lebensmittel,Molkereiprodukte/Desserts,0.44,2025-05-19,2025-05-24,Penny
EHRMANN Vanille- Früchte- oder Grießtraum (App-Preis) (versch. Sorten je 115g),Lebensmittel,Molkereiprodukte/Desserts,0.33,2025-05-19,2025-05-24,Penny
FERRERO Kinder Pingui (je 8x30g),Lebensmittel,Süßwaren/Kühlregal,2.79,2025-05-19,2025-05-24,Penny
FERRERO Kinder Pingui (App-Preis) (je 8x30g),Lebensmittel,Süßwaren/Kühlregal,1.99,2025-05-19,2025-05-24,Penny
MILPRIMA Milchdrink (versch. Sorten je 500ml),Getränke,Milchmischgetränke,0.89,2025-05-19,2025-05-24,Penny
MILPRIMA Milchdrink (App-Preis) (versch. Sorten je 500ml),Getränke,Milchmischgetränke,0.77,2025-05-19,2025-05-24,Penny
Rama Cremefine (versch. Sorten je 250ml),Lebensmittel,Molkereiprodukte/Sahneersatz,0.95,2025-05-19,2025-05-24,Penny
RAMA Culinesse (je 750ml),Lebensmittel,Margarine/Fette,1.99,2025-05-19,2025-05-24,Penny
BÄRENMARKE Eiskaffee Klassisch (je 1l),Getränke,Kaffeegetränke,1.59,2025-05-19,2025-05-24,Penny
BÄRENMARKE Haltbare Milch (3.8% oder 1.5% Fett je 1l),Lebensmittel,Molkereiprodukte/Milch,1.11,2025-05-19,2025-05-24,Penny
PENNY Käseaufschnitt (je 250g),Lebensmittel,Molkereiprodukte/Käse,2.19,2025-05-19,2025-05-24,Penny
PENNY Gouda-Scheiben (je 400g),Lebensmittel,Molkereiprodukte/Käse,2.99,2025-05-19,2025-05-24,Penny
PENNY Gouda-Scheiben (App-Preis) (je 400g),Lebensmittel,Molkereiprodukte/Käse,2.79,2025-05-19,2025-05-24,Penny
PENNY Edamer (je 400g),Lebensmittel,Molkereiprodukte/Käse,2.99,2025-05-19,2025-05-24,Penny
PENNY Emmentaler (je 400g),Lebensmittel,Molkereiprodukte/Käse,3.99,2025-05-19,2025-05-24,Penny
PENNY Emmentaler (App-Preis) (je 400g),Lebensmittel,Molkereiprodukte/Käse,3.49,2025-05-19,2025-05-24,Penny
